동영상ID,트렌드날짜,제목,채널명,카테고리ID,게시시각,조회수,좋아요수,싫어요수,댓글수,댓글비활성,평점비활성,오류또는삭제
QbDuBTWrU-o,17.09.12,My House Burned Down,William Osman,28,2017-12-06T02:04:58.000Z,1014674,74889,1172,16121,False,False,False
H7MRHuzCNvM,18.08.03,What it's Like to be a Line Cook at a Top-Rated NYC Restaurant | Bon Appétit,Bon Appétit,24,2018-03-02T17:00:08.000Z,378924,7710,300,606,False,False,False
4HX6R88QZB0,18.30.05,Original 2007 iPhone Unboxing!!!,iJustine,22,2018-05-07T14:31:43.000Z,1255581,34039,5504,6320,False,False,False
CbWP9nvnRhw,18.08.05,The Pun Challenge!?,nigahiga,24,2018-04-27T18:55:53.000Z,3469841,205472,4043,18002,False,False,False
tIYJcjhINqA,18.06.04,Potatoes - You Suck at Cooking (episode 74),You Suck At Cooking,26,2018-04-01T22:26:12.000Z,690815,33559,1585,5985,False,False,False
iGXYZwZEZa0,17.09.12,How small a hole can a mouse get through?  Experiments.,Matthias Wandel,26,2017-12-08T12:30:01.000Z,389888,10015,781,2351,False,False,False
pXxA_8C3HHQ,18.05.02,Moving Into a Motorhome,William Osman,28,2018-02-03T14:00:09.000Z,236485,13340,118,987,False,False,False
ai6NByMmCVU,18.21.03,Disney Princess Pushing A Truck,Daily Dose Of Internet,24,2018-03-14T22:01:26.000Z,1094582,40771,804,5605,False,False,False
vGTTSdrV37U,18.05.04,Camila Cabello WINS Favorite Breakout Artist 🎤!! | Kids' Choice Awards 2018 | Nick,Nickelodeon,24,2018-03-25T01:22:15.000Z,735035,13218,810,1923,False,False,False
sIMChzE_aCo,18.23.03,"SICARIO, Day of the Soldado - Official Trailer (HD)",Sony Pictures Entertainment,24,2018-03-20T00:00:41.000Z,9391723,16933,745,1926,False,False,False
hpapqEeb36k,17.21.11,Pumpkin Pie - You Suck at Cooking (episode 68),You Suck At Cooking,26,2017-11-15T14:52:38.000Z,889168,36219,895,1967,False,False,False
eSHe32cEKqI,18.30.03,Everything Yolanda Hadid Eats In a Day | Food Diaries | Harper's BAZAAR,Harper's BAZAAR,26,2018-03-23T18:02:08.000Z,472073,10463,470,817,False,False,False
tVlb8rVs7kU,18.07.02,Night-Light-Table (nightstand with automatic light switch),Laura Kampf,26,2018-02-04T13:22:33.000Z,104637,7092,84,519,False,False,False
4Cc-U8uhXYk,17.23.12,THE HAIR COLOR THAT WILL BEST SUIT YOU AND YOUR SKIN TONE! | bradmondo,Brad Mondo,23,2017-12-18T22:56:00.000Z,330669,13094,310,2189,False,False,False
VaGcPRMY5UM,18.17.04,"Tinashe - Me So Bad (Official Video) ft. Ty Dolla $ign, French Montana",TinasheOfficialVEVO,10,2018-03-30T04:00:02.000Z,6735836,155855,6039,6139,False,False,False
L5hl45NIAhc,18.23.02,"'Big one' knocks out several heavy-hitters, sends Daytona 500 to OT",NASCAR,17,2018-02-19T00:35:38.000Z,56267,381,40,174,False,False,False
KkhR9z6pAMs,17.21.11,Mali Music and Jennifer Hudson are recording a song!,Tamika Hall,24,2013-03-22T22:46:47.000Z,5224,13,1,1,False,False,False
n2wIqXBz4os,18.11.06,Waking Up With Ariana Grande | British Vogue,British Vogue,24,2018-06-08T14:58:31.000Z,1289326,64960,1530,2277,False,False,False
N54fzGwMybk,18.28.02,SCREW DRIVE RC TANK #6 IT WORKS!!!,Ivan Miranda,28,2018-02-23T21:00:02.000Z,53192,2832,31,693,False,False,False
S2Cq_TpNXoQ,17.29.11,Zero Mass' solar panels turn air into drinking water,The Verge,28,2017-11-28T14:00:04.000Z,75780,2932,147,340,False,False,False
cDDF4pPwEUU,17.21.11,"Jaylen Brown Full Highlights 2017.11.16 vs Warriors - 22 Pts, 7 Rebs, 2 Blks!",FreeDawkins,17,2017-11-17T04:25:04.000Z,27757,409,5,131,False,False,False
4srOE3pCCo8,18.25.03,What's inside Pizza Ordering Shoes?,What's Inside?,17,2018-03-17T15:17:46.000Z,1319132,14582,3703,2694,False,False,False
RrhSJzM8NLE,17.21.11,alt-J - Pleader (Official Video),alt-J,10,2017-11-15T13:10:12.000Z,507987,14112,626,847,False,False,False
UJIo1AtoTss,18.27.03,Foster The People - Sit Next to Me (Around The World),fosterthepeopleVEVO,10,2018-03-15T14:00:04.000Z,1086185,39395,652,1932,False,False,False
DZAiRufPx9A,18.17.05,SOLVED: Yanny or Laurel,jacksfilms,23,2018-05-16T03:16:53.000Z,1127253,75118,2816,6832,False,False,False
Ah7ldw_WmtE,17.05.12,Green Light - Cyanide & Happiness Minis,ExplosmEntertainment,23,2017-11-28T06:00:00.000Z,647516,33556,572,1472,False,False,False
SMvZa784oow,18.17.04,My Everyday 10 Minute Makeup Tutorial | UPDATED,Laura Lee,26,2018-04-15T21:00:19.000Z,397126,24008,539,1795,False,False,False
AZ4sakIfXUE,17.24.12,Things We Should Leave in 2017,ConnorFranta,22,2017-12-18T19:17:48.000Z,245164,38202,613,2704,False,False,False
AFbu21AGSho,18.11.06,Watch a Hercules Beetle Metamorphose Before Your Eyes | Nat Geo Wild,Nat Geo WILD,15,2018-05-22T12:00:00.000Z,1113040,19200,649,2197,False,False,False
6tgptWcKkgc,18.30.04,We Tried The Zero Waste Lifestyle For A Week 🗑️♻️,Michelle Khare,24,2018-04-16T19:32:09.000Z,198573,9656,113,640,False,False,False
XUIwpXq_jBo,18.14.03,TOMB RAIDER TEMPLE CAKE - NERDY NUMMIES,Rosanna Pansino,26,2018-03-06T18:45:38.000Z,523067,19698,335,3522,False,False,False
zWrMvW7S3tg,18.20.03,The Infinity War trailer but I just name characters as they appear,jacksfilms,23,2018-03-16T17:16:53.000Z,1214456,88193,4878,11369,False,False,False
oBVr0nUC5AA,17.02.12,2018 Rock + Metal Grammy Nominees Revealed,Loudwire,10,2017-11-28T16:46:38.000Z,24102,729,23,298,False,False,False
yc2m1LLa9l4,17.21.11,grown-ish | grown-ish x b-fast club | Freeform,Freeform,24,2017-11-16T17:38:43.000Z,7978,219,2,12,False,False,False
Wzq4qbNRFrw,18.08.06,HIGH SCHOOL IN 2008 VS 2018,Smosh,23,2018-05-30T16:00:05.000Z,3047432,82269,10799,7411,False,False,False
aHR5vpQicqw,18.03.03,Court hearing held for Nikolas Cruz,ABC Action News,24,2018-02-19T19:20:02.000Z,1436312,7268,804,7497,False,False,False
lpFEpDPf490,18.19.05,MET GALA 2018 FASHION REVIEW // Grace Helbig,Grace Helbig,22,2018-05-08T09:31:07.000Z,430640,22158,1142,1080,False,False,False
D2mxKEa2xmA,18.21.05,10 Most Devastating Cyber Attacks in History,MatthewSantoro,24,2018-05-13T13:00:01.000Z,217047,7861,667,776,False,False,False
8eo-L_3OWAQ,17.22.12,Lucky the iPhone singing cockatiel is OVER it!,Ben Pluimer,1,2017-12-20T15:43:22.000Z,1950782,36227,1980,2552,False,False,False
FkiQ67FtycI,18.18.04,Unboxing and wearing the fursuit,jacksfilms,23,2018-04-04T21:01:21.000Z,1405318,131771,2314,20591,False,False,False
uVcvhKTVZ8g,18.07.05,Clash Royale: CLAN WARS IS HERE!,Clash Royale,20,2018-04-21T08:19:59.000Z,11913359,159889,6727,14310,False,False,False
rNaFB-IoXaA,18.12.02,Kehlani - Again [Official Audio],kehlani parrish,10,2018-02-09T04:57:29.000Z,370209,24183,270,1137,False,False,False
GbrueARGMhE,18.11.03,Olympian Adam Rippon Has Been Sleeping on Shawn Mendes,TheEllenShow,24,2018-03-01T14:00:28.000Z,1621409,42111,1922,2716,False,False,False
TxY10VhmLR4,18.04.03,NEW* TOO FACED UNICORN MAKEUP COLLECTION | HIT OR MISS..,Laura Lee,26,2018-02-28T22:27:04.000Z,677426,28961,1421,30265,False,False,False
rQEqKZ7CJlk,18.19.05,Bangabandhu Satellite-1 Mission,SpaceX,28,2018-05-11T20:56:59.000Z,3104422,50489,5829,6425,False,False,False
AgrK2P3Ruug,17.07.12,Saoirse Ronan says first-time movie director Greta Gerwig was born to do 'Lady Bird',Good Morning America,24,2017-12-04T15:15:15.000Z,8633,99,1,9,False,False,False
x_IG4DeedB4,18.16.02,what working tech support is REALLY like,Alex Meyers,24,2018-02-13T12:00:06.000Z,251104,16189,276,1058,False,False,False
raJMFayG5UA,18.24.05,Royal wedding 2018: Lip-reader on what Meghan and Harry said - BBC News,BBC News,25,2018-05-20T15:42:31.000Z,430201,2496,389,626,False,False,False
xTlNMmZKwpA,18.12.06,"Cardi B, Bad Bunny & J Balvin - I Like It [Official Music Video]",Cardi B,10,2018-05-29T14:05:10.000Z,85159766,1747201,97897,98163,False,False,False
EQzWr52gCWA,18.27.01,3D Printed Desk with Fusion 360,Desktop Makes,28,2018-01-19T15:20:21.000Z,3616,136,1,42,False,False,False
nk3a7zq84Co,18.04.02,Game Day Artichoke Dip - You Suck at Cooking (episode 71),You Suck At Cooking,26,2018-01-30T14:59:44.000Z,426595,23908,227,2543,False,False,False
XiIShINrftE,17.15.12,Taylor Swift - ‘Look What You Made Me Do’ (Live At Capital’s Jingle Bell Ball 2017),Capital FM,10,2017-12-10T23:11:07.000Z,1292990,40523,3830,3088,False,False,False
Y1IMfvF8aQ0,18.03.01,Enth E Nd (Official Video) - Linkin Park,Linkin Park,10,2017-12-27T18:01:02.000Z,874106,94695,2342,6644,False,False,False
5tPugvYE6wM,18.10.03,KYLIE COSMETICS WEATHER COLLECTION REVIEW + TUTORIAL,Nicol Concilio,26,2018-02-28T21:00:35.000Z,631381,22339,3563,3044,False,False,False
v23_b_V6beI,18.08.03,How I Did My Makeup in HIGH SCHOOL,Jessica Clements,26,2018-02-28T20:00:05.000Z,143422,4385,196,457,False,False,False
dKoIPuifJvE,18.02.04,The Handmaid’s Tale Season 2 Trailer (Official) • The Handmaid's Tale on Hulu,Hulu,24,2018-03-28T17:18:31.000Z,8876499,4801,387,577,False,False,False
X9Qh8vsSE-c,18.11.06,"I Filled My Swimming Pool with 10,000 Water Balloons!",Guava Juice,24,2018-05-27T16:45:02.000Z,2118532,89823,5846,12519,False,False,False
cYkDfWdlLak,18.10.06,Firefighting with Niecy Nash | Kevin Hart: What The Fit Episode 14 | Laugh Out Loud Network,LOL Network,23,2018-06-07T17:26:44.000Z,718017,20558,882,1466,False,False,False
irHqI9fUc4I,18.12.06,France's Migrant Hero - Between the Scenes | The Daily Show,The Daily Show with Trevor Noah,23,2018-05-31T02:15:02.000Z,579495,16461,694,855,False,False,False
dwvVhnQTfDk,18.07.03,My friend sent me this video of a bison in his car with no context,notnotryan,23,2018-02-23T06:32:36.000Z,2595553,47657,2373,4034,False,False,False
NRs3YCJDBAs,18.20.03,Woke Up Late Quick Makeup & Hair Tutorial,Christen Dominique,26,2018-03-08T03:31:25.000Z,473057,22381,736,1573,False,False,False
ZhEz1cvC1rc,18.22.05,Game Theory: How RICH is a Pokemon Master?,The Game Theorists,20,2018-05-19T18:04:47.000Z,2792823,100990,3891,45399,False,False,False
uiZprtMUyCM,18.14.03,'Bachelor' Finale: Worst Breakup Ever? | The View,The View,24,2018-03-06T16:15:15.000Z,388029,2058,1253,796,False,False,False
B9127l-xpdE,17.03.12,Best NBA Handles and Crossovers of the Month | November 2017,NBA,17,2017-12-02T14:00:01.000Z,48587,756,21,23,False,False,False
fPeQR-_JBzU,18.02.04,Dancing Furry Ball!,barnabydixon,1,2018-03-23T19:05:39.000Z,123629,9990,89,619,False,False,False
de8K18_G0qk,18.31.01,Ferras - Coming Back Around,FerrasVEVO,10,2018-01-26T17:00:08.000Z,16387,1227,12,159,False,False,False
OPaybxgucww,17.22.11,"The Walking Dead: No Man’s Land by Hannah Stocking, Anwar Jibawi & Inanna Sarkis",Hannah Stocking,23,2017-11-21T18:00:01.000Z,308230,21947,397,876,False,False,False
UfKmSfgFxi8,18.04.06,FORTNITE The Movie (Official Fake Trailer),nigahiga,24,2018-05-11T21:11:16.000Z,14834674,544906,15876,26820,False,False,False
D52qnC7dJcQ,18.12.05,Snow Patrol - What If This Is All The Love You Ever Get? (Official Video),SnowPatrolVEVO,10,2018-05-02T16:30:00.000Z,847284,22305,360,929,False,False,False
zwEn-ambXLw,18.28.03,This Is Me - Cover by Shoshana Bean Featuring Travis Wall,Shoshana Bean,10,2018-03-22T08:30:07.000Z,153168,5648,92,233,False,False,False
W7a8qyJ5W74,18.11.02,Funniest One Chip Challenge Ever (World's Hottest Chip),NewsFunnies,23,2018-02-07T16:31:51.000Z,214015,790,78,137,False,False,False
3g246c6Bv58,18.16.01,Why Is Blue So Rare In Nature?,It's Okay To Be Smart,27,2018-01-09T14:35:37.000Z,713748,32489,429,2401,False,False,False
0QDjTwsEeE0,18.07.02,Can You Recognize These Songs When Played Backwards?,Vinheteiro,24,2018-02-05T17:30:00.000Z,192512,8404,262,850,False,False,False
9flXyzcSfT4,18.28.01,R3HAB x Mike Williams - Lullaby (Official Video),R3HAB,10,2018-01-26T15:59:16.000Z,201394,13761,68,695,False,False,False
jYuQzAxBVZU,18.15.05,"Benedict Cumberbatch, Tom Hiddleston and Tom Holland dish on 'Avengers: Infinity War'",Good Morning America,24,2018-04-09T14:23:23.000Z,1270251,26596,348,1691,False,False,False
TjXQzRWmb_I,18.22.05,Destination Wedding Trailer #1 (2018) | Movieclips Trailers,Movieclips Trailers,1,2018-05-16T20:29:17.000Z,3559290,46698,1378,5844,False,False,False
xF99M6Zilac,18.05.01,17 Weird Ways To Survive School / Back To School Life Hacks,Troom Troom,26,2017-12-26T20:00:04.000Z,5452904,44368,11615,6256,False,False,False
WPZfIKy7LWo,18.18.04,EVERY LATE NIGHT TALK SHOW EVER,Smosh,23,2018-04-09T16:00:03.000Z,1208172,56047,1826,4697,False,False,False
cy9W-ZywVPc,18.03.03,Trying to Get Into Fitness & Health,Jaiden Animations,1,2018-02-18T19:36:19.000Z,3042679,191479,1240,31447,False,False,False
zO0dIgvpmfw,18.05.04,10 Things Shawn Mendes Can't Live Without | GQ,GQ,26,2018-03-27T16:00:27.000Z,574615,37861,307,1231,False,False,False
EQzWr52gCWA,18.26.01,Fusion 360 to 3D Print Parts to Build a Desk,Desktop Makes,28,2018-01-19T15:20:21.000Z,3390,129,1,43,False,False,False
FaJmopuuhZE,17.22.11,Josh Groban - Happy Xmas (War Is Over) [Official Music Video],Josh Groban,10,2017-11-20T16:00:08.000Z,92364,3589,130,392,False,False,False
MpaHR-V_R-o,18.13.03,Gotta Catch ‘Em All!,The Official Pokémon YouTube Channel,20,2018-02-27T15:45:31.000Z,802648,46224,1071,6849,False,False,False
r9lQggOQGvw,18.23.04,Liam Payne Goes Sneaker Shopping With Complex,Complex,24,2018-04-16T14:00:03.000Z,1142433,29625,1148,2878,False,False,False
8h--kFui1JA,18.02.06,Sam Smith - Pray (Official Video) ft. Logic,SamSmithWorldVEVO,10,2018-05-09T17:00:00.000Z,18142370,344234,8859,12141,False,False,False
dPWg-A9tiRI,18.26.01,Drunk History - Rose Valland Takes On the Nazis,Comedy Central,23,2018-01-23T21:30:01.000Z,236301,4614,202,320,False,False,False
_9YMpuLDnwo,17.11.12,42 HOLY GRAIL HACKS THAT WILL SAVE YOU A FORTUNE,5-Minute Crafts,26,2017-12-03T08:30:00.000Z,54155921,378111,66632,24679,False,False,False
ItL6vcUrpUs,17.30.12,MACKLEMORE FEAT DAVE B & TRAVIS THOMPSON - CORNER STORE (Official Music Video),Macklemore LLC,10,2017-12-21T17:00:20.000Z,3286123,117759,2941,4271,False,False,False
FvLdEZ3mg54,18.20.01,1992 Skin Bracer commercial w/Jack Palance,gamelovercommercials,24,2017-02-18T15:21:10.000Z,22581,365,64,203,False,False,False
HFGzgtMyOZY,18.24.04,LAZY BOY Vs. TRAMPOLINE from 45m!,How Ridiculous,17,2018-04-20T22:00:00.000Z,1308055,64840,2495,6974,False,False,False
f45Va7jMSx4,17.22.11,HOW TO TAKE KIDS TO A RESTAURANT,How to DAD,22,2017-11-19T23:02:11.000Z,129118,4341,171,273,False,False,False
PV_GHHXy7Po,18.02.06,Joey Graceffa's Enchanted Gaming Room Makeover! | OMG We're Coming Over,Mr. Kate,26,2018-05-24T22:00:05.000Z,1196451,66027,575,5497,False,False,False
PUvVjWR3zTQ,17.12.12,Sufjan Stevens - Tonya Harding (Official Audio),Asthmatic Kitty Records,10,2017-12-06T11:58:45.000Z,360637,5343,228,522,False,False,False
cX-X_UFUyYE,18.02.02,バーレルなねこ。-Maru Bucket.-,mugumogu,15,2018-01-31T00:14:21.000Z,47706,2519,19,265,False,False,False
u9Mv98Gr5pY,18.27.04,VENOM - Official Trailer (HD),Sony Pictures Entertainment,24,2018-04-24T03:45:03.000Z,45759148,1166894,40086,127694,False,False,False
7gdoj1ViJ8M,18.21.03,RED DEAD REDEMPTION HORSESHOE COOKIES ft sWooZie! - NERDY NUMMIES,Rosanna Pansino,26,2018-03-20T14:13:00.000Z,124534,8520,108,1649,False,False,False
00nmxR1mxIA,17.10.12,Lost 'Star Wars' Footage Of Luke Skywalker At The Cantina,The Late Show with Stephen Colbert,24,2017-12-09T08:35:00.000Z,425487,7105,408,701,False,False,False
2HboMs0vbsE,17.02.12,[2017 MAMA in Hong Kong] BTS_INTRO Perf. + Not Today,Mnet K-POP,24,2017-12-01T14:51:39.000Z,2289723,199777,4451,10481,False,False,False
U0z-x5O_Jpw,18.09.05,Elizabeth Olsen's Boyfriend Is Now Her Roommate,The Late Late Show with James Corden,24,2018-05-02T08:35:00.000Z,1158503,14825,277,867,False,False,False
u5Jw7D-c3II,17.07.12,"Selena Gomez talks going on tour, Instagram plus more!",KISS FM UK,10,2017-12-05T14:00:49.000Z,48870,1122,36,100,False,False,False
PLAFNvxDPMw,17.29.12,Impossible Rubik's Cubes,standupmaths,24,2017-12-21T15:09:12.000Z,220371,6619,244,811,False,False,False
CJUgcgFNNWA,18.06.03,Whats inside a FLAMING BATTLE AX?,What's Inside?,24,2018-02-24T14:30:01.000Z,169130,4295,300,872,False,False,False
Q1INhRBrwKM,18.08.01,I Said I Would NEVER Do This To My Truck... BIG MODS INCOMING!,Street Speed 717,2,2018-01-02T04:29:12.000Z,235025,9334,317,1152,False,False,False
Xc675sarBYc,17.25.12,"Watch My Orphaned Kitten Grow up (Also, Some Sad News..)",Taylor Nicole Dean,15,2017-12-20T02:16:30.000Z,500972,32717,904,6000,False,False,False
JnepCulEQOo,17.25.12,"Tesla Santa Mode Easter Egg with Icy Roads, Reindeer, Jingle Bells and More",DragTimes,2,2017-12-23T23:57:32.000Z,30484,386,33,62,False,False,False
45tSUnisIos,18.07.05,5 Signs You Work With Cats,Cole and Marmalade,15,2018-04-29T14:08:24.000Z,169542,11543,75,1059,False,False,False
tE5C3O71Xqo,17.24.12,"SpaceX Iridium 4 Launch from Alhambra, CA",Doug Ellison,28,2017-12-23T02:02:34.000Z,985639,15241,963,0,True,False,False
qXU2qTRjBKU,18.02.02,"Michael Wolff, “Fire and Fury | theSkimm Sip 'n Skimm",theSkimm,22,2018-01-31T17:32:26.000Z,11216,2,14,13,False,False,False
LUuJl490BL0,18.11.02,Justin Timberlake covers Prince at Super Bowl half-time show,Guardian News,25,2018-02-05T08:40:02.000Z,204747,920,278,309,False,False,False
htBvEmGPhAc,18.10.02,"Scared abandoned dog hides in a spot that we couldn't reach, so I had no choice but...",Hope For Paws - Official Rescue Channel,15,2018-02-07T16:00:22.000Z,418656,21910,411,1399,False,False,False
2NpetP71B1o,17.29.12,AMAZING CANADIAN FOOD | INSANELY HUGE Christmas Turkey DINNER FEAST and EGGS BREAKFAST in CANADA,The Food Ranger,19,2017-12-27T15:00:00.000Z,285129,11625,335,2409,False,False,False
cIQKKzZtWwQ,18.02.01,Sugarland - Still The Same,SugarlandVEVO,10,2017-12-21T05:00:00.000Z,624894,7103,677,410,False,False,False
s8ZMmgPcO-k,18.06.02,"Amazon 2018 Super Bowl Commercial | Alexa Loses Her Voice (Cardi B, Gordon Ramsey)",TopClips247,24,2018-02-01T19:54:34.000Z,740553,5417,172,290,False,False,False
fNVUTgd4pio,18.22.04,Sugarland - Babe (Static Video) ft. Taylor Swift,SugarlandVEVO,10,2018-04-20T04:00:07.000Z,1145367,43579,1179,3347,False,False,False
5ek2W8hUvGw,18.13.05,My Sister in Real Life,itsAlexClark,1,2018-05-09T21:51:32.000Z,2147339,78406,1577,5989,False,False,False
alRtHXnZMOI,17.22.12,The Ginger Ed Man,Spotify,10,2017-12-20T17:02:12.000Z,20646,545,23,36,False,False,False
ZsvViZgVXL8,18.06.02,Sarah Jessica Parker On Kim Cattrall’s Diss | WWHL,Watch What Happens Live with Andy Cohen,24,2018-02-01T13:59:48.000Z,468363,992,155,304,False,False,False
VYOjWnS4cMY,18.16.05,Childish Gambino - This Is America (Official Video),ChildishGambinoVEVO,10,2018-05-06T04:00:07.000Z,126191952,3587455,205995,377394,False,False,False
YPHDFdk_BW8,17.10.12,Danny Masterson Fired From Netflix Series 'The Ranch' Amid Rape Allegations | Access Hollywood,Access Hollywood,24,2017-12-05T18:36:45.000Z,1774,14,5,10,False,False,False
WhJIUtMK1tU,17.24.12,The Rock’s Make a Wish Surprise,The Rock,24,2017-12-22T11:30:01.000Z,71276,5127,48,480,False,False,False
pfX353Wc0GA,18.02.02,Spiderman dancing Take on me by A-Ha | DJ IVAN DAVIS,PAC ENTRETENIMENTO / DJ IVAN DAVIS,24,2018-01-29T16:10:45.000Z,165957,1969,46,88,False,False,False
oOZ_Q6qzXuw,18.25.02,"Here's a Tour of a $50,000 Honda Odyssey Minivan",Doug DeMuro,2,2018-02-20T16:58:31.000Z,1007344,20700,1130,7224,False,False,False
6tAB3YwWkxY,18.12.03,Andy Samberg | Breakfast Club in memoriam tribute | 2018 Film Independent Spirit Awards,Film Independent,1,2018-03-04T20:04:54.000Z,263216,4448,190,188,False,False,False
5IyiD8xv_Pk,18.16.01,Smart Ferret Opens Drawer || ViralHog,ViralHog,15,2018-01-09T17:26:17.000Z,6447,30,4,4,False,False,False
3WlhLmh7uiQ,18.29.04,"MAKING BEAUTIFUL, SIMPLE ANT FARMS",AntsCanada,15,2018-04-21T18:00:32.000Z,670279,28840,649,7215,False,False,False
HCO7BWbKipU,18.04.03,You'll NEVER guess how I caught this lizard!,Brave Wilderness,15,2018-03-02T12:00:03.000Z,1112090,28345,746,5003,False,False,False
s_LxZx42sIk,18.22.01,What are mini brains? - Madeline Lancaster,TED-Ed,27,2018-01-16T16:00:49.000Z,256900,8884,162,532,False,False,False
YS2y_12IWlA,18.14.02,Jet Engine VS FACE (Flying Like Iron Man Update),the Hacksmith,28,2018-02-08T17:30:00.000Z,2652565,46644,1973,4137,False,False,False
jlmNwjdYVnk,18.17.04,Boy Sings Out in Walmart || ViralHog,ViralHog,10,2018-03-26T18:24:47.000Z,2009445,33873,2291,6453,False,False,False
MT7RQ0gu8ak,18.15.05,DO PARENTS KNOW MODERN MUSIC? #17 (REACT: Do They Know It?),REACT,24,2018-05-13T19:00:01.000Z,800873,19909,744,5017,False,False,False
eOQpjvnm4ME,17.22.11,The Bipartisan Pastime Of Harassing Women,The Late Show with Stephen Colbert,24,2017-11-17T08:35:01.000Z,2016029,21062,2319,4200,False,False,False
coOKvrsmQiI,17.22.11,RAMPAGE - OFFICIAL TRAILER 1 [HD],Warner Bros. Pictures,24,2017-11-16T21:15:08.000Z,15104666,143947,12709,25593,False,False,False
y0BlGqwLLGQ,17.23.12,Foot Locker x Jordan - “#BoldLikeKawhi” feat. Kawhi Leonard,Foot Locker,24,2017-12-20T16:54:03.000Z,1134844,1010,41,186,False,False,False
VNqrILFD5h0,17.22.11,Macklemore’s Naked Justin Bieber Painting | WWHL,Watch What Happens Live with Andy Cohen,24,2017-11-17T12:59:51.000Z,137792,632,211,170,False,False,False
wSwewlSkIXU,17.02.12,Five Finger Death Punch - Gone Away (Lyric Video),5FDPVEVO,10,2017-12-01T05:00:05.000Z,202697,13976,255,1143,False,False,False
VW-5B_g8CrY,18.23.01,Aaron Hernandez was a chameleon says NFL sportswriter,CBS News,25,2018-01-20T21:26:16.000Z,3645,42,4,21,False,False,False
nd4cLL_MP7M,18.27.05,Mamma Mia! Here We Go Again - Final Trailer,Universal Pictures,24,2018-05-08T12:15:07.000Z,4553144,16065,855,854,False,False,False
q6xkWA0Qi98,17.09.12,Cup Phones - JACK AND DEAN,Jack and Dean,23,2017-12-03T17:48:44.000Z,154997,21475,162,814,False,False,False
VfAOl67WcLY,17.29.11,"The Walking Dead: No Man’s Land by Anwar Jibawi, Hannah Stocking & Inanna Sarkis",Anwar Jibawi,23,2017-11-22T18:00:02.000Z,1262895,39517,1525,1999,False,False,False
LTNOYZ44ywM,17.23.12,"Amtrak Train Derails Near Olympia, Washington | CNBC",CNBC,25,2017-12-18T17:40:48.000Z,143064,427,199,321,False,False,False
jiZfc0b2t3Q,18.17.05,Adam Dunn had the weirdest career in MLB history | Dorktown,SB Nation,17,2018-05-01T22:53:23.000Z,712607,10400,856,1447,False,False,False
MTf2X6EHyLQ,18.14.03,I Tried a $700 Dyson Vacuum...,Austin Evans,28,2018-03-06T15:01:40.000Z,502042,14158,6915,3422,False,False,False
gvuvxLzUB-w,18.24.01,Amazon Go lets you skip the checkout line,USA TODAY,25,2018-01-21T15:12:02.000Z,204499,2121,881,1449,False,False,False
3McYSX6jSIg,18.22.02,Ready to Serve | Romney for Utah,mittromney,22,2018-02-16T13:21:55.000Z,99373,1014,1536,772,False,False,False
8eo-L_3OWAQ,17.26.12,Lucky the iPhone singing cockatiel is OVER it!,Ben Pluimer,1,2017-12-20T15:43:22.000Z,3299667,48488,2991,2760,False,False,False
fMaC7IeGKNQ,18.27.03,Jeff Goldblum Recorded His Part In Isle Of Dogs Over The Phone  - CONAN on TBS,Team Coco,23,2018-03-15T20:16:43.000Z,281858,5130,86,326,False,False,False
cclI_B8TYdg,18.12.05,Watch live: CIA nominee Gina Haspel testifies in Senate hearing,Washington Post,25,2018-05-09T16:36:49.000Z,137016,715,565,716,False,False,False
_5d-sQ7Fh5M,18.08.02,LOGAN PAUL IS BACK!,Logan Paul Vlogs,24,2018-02-04T22:02:27.000Z,13754992,1207457,280675,432534,False,False,False
exsOim0Lyl4,18.02.02,President Donald Trump’s State of the Union Address 2018 (Full) | NBC News,NBC News,25,2018-01-31T06:36:37.000Z,1706319,21235,17528,6684,False,False,False
A9k89DYdHKQ,18.22.02,Janelle Monáe - Dirty Computer [Trailer],Janelle Monáe,10,2018-02-16T14:00:03.000Z,537822,6686,837,682,False,False,False
Ep6-bNu16_I,17.16.12,I Dressed According To My Zodiac Sign For A Week,Safiya Nygaard,22,2017-12-10T05:55:09.000Z,2828138,129998,1990,22065,False,False,False
mSgDg1oiOCs,17.16.12,YouTuber Holiday Gift Wrapping (ft. Eva Gutowski & Kyle Krieger),Tyler Oakley,24,2017-12-12T20:01:09.000Z,52590,5211,39,1031,False,False,False
2WHcBwq2wHc,18.30.03,Mo Salah bursts through wall to surprise kids | KOP KIDS PRANK,Liverpool FC,17,2018-03-28T10:57:56.000Z,2266235,61544,952,0,True,False,False
THr_seahKUI,17.01.12,2017 Christmas Decorations at the White House,The White House,25,2017-11-27T14:17:59.000Z,1544644,30594,22590,18555,False,False,False
uA8GdJJqz_s,18.24.03,Physicist Stephen Hawking has died,CNN,25,2018-03-14T04:46:28.000Z,3512790,56242,2466,32475,False,False,False
3Q2j5ApzSqs,18.10.06,Christina Aguilera - Fall In Line (Official Video) ft. Demi Lovato,CAguileraVEVO,10,2018-05-23T17:00:01.000Z,15519728,506022,14001,25866,False,False,False
GrnswGtm_Sw,18.28.02,2018 Winter Olympics Daily Recap Day 16 I Part 2 I NBC Sports,NBC Sports,17,2018-02-25T18:22:37.000Z,201894,835,289,373,False,False,False
3WlhLmh7uiQ,18.05.05,"MAKING BEAUTIFUL, SIMPLE ANT FARMS",AntsCanada,15,2018-04-21T18:00:32.000Z,706137,29615,672,7352,False,False,False
t1shnJT8NCY,17.22.11,"We Can All Do Better Than Roy Moore | November 15, 2017 Act 1 | Full Frontal on TBS",Full Frontal with Samantha Bee,22,2017-11-16T07:00:04.000Z,680306,7994,2662,1421,False,False,False
36tggrpRoTI,18.26.04,Shawn Mendes - In My Blood,ShawnMendesVEVO,10,2018-04-24T16:00:01.000Z,5202242,785634,4877,59235,False,False,False
9Rr9u6QGgVc,18.04.06,STRANGERS DO MY MAKEUP IN AUSTRALIA,James Charles,24,2018-05-29T21:00:31.000Z,2006182,146833,3135,17678,False,False,False
YrVTJd6mvpE,18.23.03,"Adam Scott Goes Undercover on Reddit, Instagram, and Twitter | Actually Me | GQ",GQ,24,2018-03-15T19:00:20.000Z,341389,6166,156,311,False,False,False
XsVy4ImgM0o,17.18.12,Have Yourself A Merry Little Christmas (ft. Tori Kelly) - Jacob Collier,Jacob Collier,10,2017-12-12T20:15:51.000Z,150880,10110,110,669,False,False,False
AkCLxl3MzNA,18.24.05,Taking A Colour Blind Test With Colour Blind Glasses,jacksepticeye,27,2018-05-15T19:00:00.000Z,1392952,52851,980,8938,False,False,False
CbWP9nvnRhw,18.11.05,The Pun Challenge!?,nigahiga,24,2018-04-27T18:55:53.000Z,3545421,207949,4098,18261,False,False,False
YrzxVhbDc-4,18.10.02,TurboTax 2018 Big Game Commercial The Thing Under the Bed (Official :30) TV ad,TurboTax,27,2018-02-04T18:54:11.000Z,606015,307,49,88,False,False,False
lklTc_DTE8Q,18.09.01,MAC X Patrick Starrr - What's GOOD?! | Jackie Aina,Jackie Aina,26,2018-01-03T03:33:21.000Z,595836,43506,585,1722,False,False,False
