동영상ID,트렌드날짜,제목,채널명,카테고리ID,게시시각,조회수,좋아요수,싫어요수,댓글수,댓글비활성,평점비활성,오류또는삭제
MyAnv1nY5Vw,17.14.12,"Keaton Jones, 11: I Hope My Viral Anti-Bullying Video Helps Other Kids | TODAY",TODAY,25,2017-12-12T15:07:05.000Z,61332,420,845,382,False,False,False
Wen6VQS6NG4,17.29.11,Giant Mousetrap powered Car,TheBackyardScientist,28,2017-11-23T02:47:34.000Z,960527,20011,1939,2161,False,False,False
BXnGUUsdnR8,18.25.03,I Let My Dog Walk Me For A Day!,Guava Juice,24,2018-03-18T21:02:03.000Z,1017284,23314,2075,5706,False,False,False
akNs04ef_Co,18.29.01,I Read A Letter From My Younger Self,AmazingPhil,26,2018-01-25T20:46:40.000Z,766100,112635,585,8874,False,False,False
cQtYcpRGGIY,18.01.01,Honey Butter Smashed Potato 🎄Asian at Home Holiday Special Recipe🎄,Seonkyoung Longest,26,2017-12-22T22:51:17.000Z,131662,6447,136,347,False,False,False
CzmIrPvIzxk,17.24.11,Honest Trailers - The Emoji Movie,Screen Junkies,1,2017-11-21T18:00:01.000Z,1861361,47240,1156,5700,False,False,False
oLrOtjfn1rw,18.01.04,Jersey Shore Cast Reacts To Pauly D’s OG Casting Tape | Jersey Shore: Family Vacation | MTV,MTV,24,2018-03-23T19:00:03.000Z,746984,7233,588,639,False,False,False
-SJywvgaJEI,18.07.05,Watch This Video When You’re Feeling Down,Markiplier,22,2018-05-03T18:00:00.000Z,1350113,134267,1756,23989,False,False,False
7cmzAjwmc5k,18.04.02,Kesha Performs Praying at 2018 Grammys,ET Canada,24,2018-01-29T03:53:05.000Z,976652,5400,1660,1428,False,False,False
15UK0924t_o,18.24.01,CELEBRITY HAIRSTYLIST DOES MY HAIR: RIHANNA!,Amber Scholl,26,2018-01-20T01:53:41.000Z,263161,14147,334,1098,False,False,False
p5HH2UfZ2wE,18.28.01,DOG TRIES TO WAKE UP SLEEPING PIG,Newsflare,15,2018-01-23T17:11:43.000Z,350040,5438,63,494,False,False,False
0gW9EnfWzDw,18.23.01,How To Make Your Own Subway Sandwich,Gus Johnson,23,2018-01-17T14:49:50.000Z,278587,18477,893,1774,False,False,False
5TLANg1GC7U,17.24.11,CHICKEN GIRLS | Annie & Hayden in “Broken” | Ep. 8,Brat,24,2017-11-22T00:27:45.000Z,2717114,73896,1335,7586,False,False,False
gfmXCAwBkCE,18.29.01,Viola Davis on Melania Trump's Love of How to Get Away with Murder,Jimmy Kimmel Live,24,2018-01-26T11:00:02.000Z,267620,3353,1111,1178,False,False,False
L0xKz5TsYb0,18.14.02,"Sting, Shaggy - Don't Make Me Wait (Official)",StingVEVO,10,2018-02-06T05:00:00.000Z,1114465,25538,822,985,False,False,False
xYb9HeucPf0,18.28.01,Steve Brown Says Attacker Was Laughing Before He Stormed Stage | TMZ,TMZ,24,2018-01-23T01:00:01.000Z,35769,209,16,98,False,False,False
CeCgsmTjHjk,18.14.04,SHANE DAWSON AND RYLAND DO MY MAKEUP,James Charles,24,2018-03-30T19:01:02.000Z,4601451,287883,5917,22414,False,False,False
LHLbPgXPnlk,18.20.01,Ned Price Says CIA Officer Arrest Is As Serious As It Seems | Velshi & Ruhle | MSNBC,MSNBC,25,2018-01-17T21:16:51.000Z,51404,396,32,240,False,False,False
4LlQwTgB5Rc,18.23.05,Dave Matthews Band - Samurai Cop (Oh Joy Begin) (Visualizer),davematthewsbandVEVO,10,2018-05-10T12:00:00.000Z,292725,4819,139,385,False,False,False
o2m06SDQJCI,18.15.01,A Prelude to Calcinosis Cutis,Dr. Sandra Lee (aka Dr. Pimple Popper),27,2018-01-09T15:00:03.000Z,304485,4420,317,515,False,False,False
NBgNCDF4lG8,18.03.02,U2 - Get Out Of Your Own Way (LIVE From The 60th GRAMMYs ®),U2VEVO,10,2018-01-29T03:01:00.000Z,795819,16804,1163,2401,False,False,False
oJ2faqXlU1s,18.18.04,Mirror-Polished Japanese Foil Ball Challenge Crushed in a Hydraulic Press-What's Inside?,The Action Lab,24,2018-04-10T15:42:48.000Z,16374073,151556,25183,12399,False,False,False
kJ18whKduFo,17.09.12,Age & Aging: Crash Course Sociology #36,CrashCourse,27,2017-12-04T22:13:37.000Z,45509,1665,144,327,False,False,False
B2MvoBRzrm4,18.08.01,Samy Kamkar: Getting Started with Reverse Engineering,HACKADAY,28,2018-01-02T19:41:55.000Z,2840,119,1,7,False,False,False
UTVpWVO4vZU,18.09.06,SIDEMEN FC VS YOUTUBE ALLSTARS 2018 (Goals & Highlights),Sidemen,24,2018-06-02T20:00:23.000Z,7041821,171424,9095,20665,False,False,False
0PW9MWDWLH8,17.24.11,WHISPER CHALLENGE w/ MY MOM // Grace Helbig,Grace Helbig,22,2017-11-22T08:23:18.000Z,117455,9627,50,791,False,False,False
8ikZqUKIHbY,18.09.02,Persil ProClean: Game-time Stain-time :30,Persil ProClean,22,2018-02-05T00:56:02.000Z,545898,203,141,112,False,False,False
cUa93K56cc0,18.02.05,Honey Roasted Carrots - You Suck at Cooking (episode 75),You Suck At Cooking,26,2018-04-26T13:01:41.000Z,856238,35605,1206,2800,False,False,False
4L-BPQVZYXM,17.24.11,Razer Phone Review: The Real Deal!,Marques Brownlee,28,2017-11-21T19:52:07.000Z,1409442,51315,1201,5699,False,False,False
5WUDfviiKRE,17.30.11,二贵摔跤 - tienghoa.net,Tina Nguyen,27,2011-03-01T04:14:08.000Z,22535,108,312,203,False,False,False
5GHXEGz3PJg,18.06.05,Florence + The Machine - Hunger,FlorenceMachineVEVO,10,2018-05-03T18:35:00.000Z,1651724,85332,887,4101,False,False,False
2fouYHWUhZo,18.17.03,Camila Cabello Watches Fan Covers On YouTube | Glamour,Glamour Magazine,24,2018-03-13T16:00:23.000Z,1271600,52603,415,2728,False,False,False
5NaAwSpswJE,18.16.04,Yodeling Kid Mason Ramsey Performs at Coachella,TMZ,24,2018-04-13T23:55:10.000Z,2303421,36573,6313,6905,False,False,False
Ph54wQG8ynk,18.09.03,Camila Cabello - Never Be the Same,CamilaCabelloVEVO,10,2018-03-08T14:00:01.000Z,3008740,402827,9020,35006,False,False,False
TmzVBGf6uKk,18.14.05,"Shawn Mendes - Lost in Japan - Choreography by Jake Kodish ft Sean Lew, Kaycee Rice, Jade Chynoweth",Tim Milgram,24,2018-05-02T00:13:56.000Z,904286,39393,291,1915,False,False,False
5mar5AHglGI,18.25.03,These Things Happened (Artist Spotlight Story) - G-Eazy,G-Eazy,24,2018-03-20T15:59:58.000Z,332072,24149,267,1429,False,False,False
Duc3F700lgE,18.24.05,NERF Hide Your Weapon Challenge!,Battle Universe,24,2018-05-04T21:15:00.000Z,1062251,11520,901,1815,False,False,False
36QMyiRAv-Y,18.10.06,Jaiden & Boyinaband - Empty (Official Music Video),Jaiden Animations,1,2018-06-08T19:08:21.000Z,2338402,307354,6607,87691,False,False,False
jyNFL5t2A-U,18.27.01,Watch Courtroom Erupt In Applause After Larry Nassar Sentencing | MSNBC,MSNBC,25,2018-01-24T19:02:11.000Z,239728,2381,273,1278,False,False,False
hhiD-TKYqHk,18.22.03,Barcelona vs. Chelsea | 2017-18 UEFA Champions League Highlights,FOX Soccer,17,2018-03-14T23:18:28.000Z,556805,4109,304,793,False,False,False
SuzlcQc1iks,18.04.05,IS IT REAL OR IS IT CHOCOLATE?!,Dobre Brothers,22,2018-04-20T20:51:42.000Z,2545603,51564,15876,10989,False,False,False
tIYJcjhINqA,18.03.04,Potatoes - You Suck at Cooking (episode 74),You Suck At Cooking,26,2018-04-01T22:26:12.000Z,524683,29599,1204,5335,False,False,False
1ndx3Hl-7ls,18.15.04,Testing Flex Shot - As Seen On TV,CrazyRussianHacker,28,2018-04-08T21:51:20.000Z,972885,14737,1376,1463,False,False,False
bWL_MVbpGT0,18.22.03,4 PRODUCERS FLIP THE SAME SAMPLE,ANDREW HUANG,10,2018-03-19T19:00:06.000Z,271946,22198,241,3452,False,False,False
IPgdIHV_zMo,18.13.02,I Feel Pretty Trailer #1 | Movieclips Trailers,Movieclips Trailers,1,2018-02-08T20:00:03.000Z,826116,9662,34813,6873,False,False,False
_akwfRuL4os,17.24.11,Highlights of the EA predatory behavior announcement,Chris Lee,22,2017-11-21T19:29:03.000Z,179448,0,0,1847,False,True,False
AOvCyD9bbDM,18.22.02,Remy Ma - Melanin Magic (Pretty Brown) ft. Chris Brown,RemyMaVEVO,10,2018-02-14T16:00:01.000Z,1969817,80735,5066,10154,False,False,False
ChqXsD5L8Ac,18.24.02,How Krispy Kreme Doughnuts are Made,INSIDER,19,2018-02-21T16:00:01.000Z,369947,5026,402,1263,False,False,False
TV42WARem_o,18.18.02,Twin Brothers Make Twin Marriage Proposals to Twin Sisters,Inside Edition,25,2018-02-14T22:23:19.000Z,274869,6498,318,1143,False,False,False
wqS9QwOIH3s,18.30.01,Natural Defined Instagram Makeup | Jessica Clements,Jessica Clements,26,2018-01-24T22:00:05.000Z,161072,8890,95,417,False,False,False
rNaFB-IoXaA,18.16.02,Kehlani - Again [Official Audio],kehlani parrish,10,2018-02-09T04:57:29.000Z,683614,32229,420,1364,False,False,False
je_0dC12gOs,18.23.05,Andrés Iniesta substituted for the final time in an FC Barcelona shirt,FC Barcelona,17,2018-05-20T21:06:15.000Z,348915,9048,139,550,False,False,False
zJ9kMg08Yds,18.29.05,Women Who Never Went To Prom Choose Prom Dresses,As/Is,22,2018-05-26T15:00:16.000Z,1049705,20624,374,1123,False,False,False
ijwHj2HaOT0,18.17.05,Google’s Duplex Assistant phone call blew my mind!,CNET,28,2018-05-08T17:43:15.000Z,546922,8919,599,1573,False,False,False
_pP_C7HEy3g,18.16.05,The Coin Hexagon - Numberphile,Numberphile,28,2018-05-03T15:28:38.000Z,316653,6880,206,558,False,False,False
m0AZ5LKlGyk,18.31.01,Man drops magnum of Champagne on the floor in Ibiza's club,MN khan,22,2018-01-24T01:46:38.000Z,1791693,1975,342,529,False,False,False
wa5eXqjEewE,18.14.04,Conor McGregor's FULL court appearance,Global News,25,2018-04-06T19:57:37.000Z,680476,3153,385,2082,False,False,False
3mRjN1Focog,17.24.12,The Harvard of Santa Schools,Great Big Story,22,2017-12-22T07:00:00.000Z,98286,3989,52,475,False,False,False
aVpvVq_yZLM,17.24.11,Second Woman Accuses Sen. Al Franken Of Inappropriate Touching | The View,The View,25,2017-11-20T16:13:29.000Z,166252,695,817,1231,False,False,False
K_XXXDPODmw,18.11.02,Taking Riverdale Quizzes with Camila Mendes and Hart Denton| Madelaine Petsch,Madelaine Petsch,22,2018-02-07T20:36:59.000Z,1325225,94326,399,3524,False,False,False
_UjAxuSuLIc,18.20.03,"How 29,000 Lost Rubber Ducks Helped Map the World's Oceans",Half as Interesting,27,2018-03-15T15:30:02.000Z,267516,11219,437,779,False,False,False
GeF_5qo00Uw,18.06.04,The House with a Clock in its Walls Trailer #1 (2018) | Movieclips Trailers,Movieclips Trailers,1,2018-03-27T15:35:00.000Z,1706292,18277,1220,1848,False,False,False
srkj63VBSHM,18.13.06,Marjory Stoneman Douglas High School Students Perform At The 2018 Tony Awards,CBS,24,2018-06-11T06:00:04.000Z,685973,12065,2045,1073,False,False,False
OBOm_jatVCI,18.11.03,Blind Fast Food Sub Sandwich Taste Test,Good Mythical Morning,24,2018-03-07T11:00:02.000Z,1913339,35617,1447,4480,False,False,False
ulNswX3If6U,18.26.05,Selena Gomez - Back To You (Lyric Video),Selena Gomez,1,2018-05-10T16:00:11.000Z,30704372,746369,13459,36461,False,False,False
doP7xKdGOKs,18.07.02,Tide | Super Bowl LII 2018 Commercial | It's a Tide Ad,Tide,24,2018-02-05T00:10:40.000Z,3844106,80016,2140,0,True,False,False
X_tYrnv_o6A,17.24.11,Your Amazing Molecular Machines,Veritasium,27,2017-11-20T15:00:02.000Z,440657,30270,224,3693,False,False,False
XHpEJRsHefM,18.09.02,Sprint Super Bowl Commercial 2018: Evelyn,Sprint,28,2018-02-01T13:30:38.000Z,1193226,1445,757,0,True,False,False
UOHURuAf5iY,18.05.04,Questions about Concrete Answered - The Basics,Practical Engineering,27,2018-03-27T11:00:04.000Z,230154,13189,113,1513,False,False,False
vOKOamXsXYE,17.02.12,The Script - Arms Open (Official Video),TheScriptVEVO,10,2017-12-01T08:00:07.000Z,110706,13066,76,877,False,False,False
LzuDyq0-1LM,18.29.05,Why it's not a British royal wedding without fancy hats,Vox,25,2018-05-18T11:00:03.000Z,471757,8092,655,736,False,False,False
IGScS6YgzBY,18.04.02,EXCLUSIVE: Porsha Williams Claps Back At Kandi Burruss' Petty Ways,Dish Nation,23,2018-01-29T20:54:26.000Z,11445,178,8,160,False,False,False
oRArmtMA9AI,18.11.03,Marshmello - Fly (Official Music Video),Marshmello,10,2018-03-09T05:01:14.000Z,3513436,226643,5078,27429,False,False,False
oFBuCp19L7M,17.04.12,"The Cast of Star Wars: The Last Jedi Talk Kylo Ren, Jedi Controversy, Harrison Ford & Secrets",Jimmy Kimmel Live,24,2017-12-02T08:30:00.000Z,868849,16083,332,1467,False,False,False
TI5bEf-BULU,18.28.05,How Michael B. Jordan's Black Panther Makeup Was Done — Exclusive Behind The Scenes,INSIDER,24,2018-05-04T13:00:03.000Z,14804684,141716,4613,6030,False,False,False
5GHXEGz3PJg,18.08.05,Florence + The Machine - Hunger,FlorenceMachineVEVO,10,2018-05-03T18:35:00.000Z,2726508,103293,1314,4505,False,False,False
sxS9h8mU2Yk,18.13.06,Sabrina Carpenter - Almost Love (Official Lyric Video),SabrinaCarpenterVEVO,10,2018-06-06T04:00:01.000Z,828390,57086,691,4412,False,False,False
g4Hbz2jLxvQ,18.09.06,SPIDER-MAN: INTO THE SPIDER-VERSE - Official Trailer (HD),Sony Pictures Entertainment,24,2018-06-06T13:00:04.000Z,14528223,389819,16256,40586,False,False,False
fNVUTgd4pio,18.26.04,Sugarland - Babe (Static Video) ft. Taylor Swift,SugarlandVEVO,10,2018-04-20T04:00:07.000Z,2071323,54307,1873,4025,False,False,False
YcCrw6d3UX4,17.24.11,President Donald Trump Pardons His First Thanksgiving Turkey At White House Ceremony | NBC News,NBC News,25,2017-11-21T19:18:02.000Z,5708,55,27,58,False,False,False
LfeEu4_vtfQ,18.05.06,Trying $1 Makeup From Wish,Safiya Nygaard,22,2018-05-31T22:31:36.000Z,4521978,177879,3508,12244,False,False,False
-xAMnJgc3oA,18.21.04,Janelle Monáe – I Like That [Official Audio],Janelle Monáe,10,2018-04-16T04:38:11.000Z,497189,18636,318,1155,False,False,False
ziLNTsTPL4k,18.13.01,2 bros chillin in a bath tub,AnthonyPadilla,23,2018-01-08T17:08:03.000Z,315999,29620,367,1303,False,False,False
BFWI0GQZA14,18.24.02,Rubber Wrecking Ball in 4k,The Slow Mo Guys,22,2018-02-20T17:00:03.000Z,1368256,41701,2329,2544,False,False,False
Su9Mns6fWV8,18.01.03,If The Walking Dead Theme Had Lyrics (Parody),The Warp Zone,23,2018-02-22T18:00:02.000Z,89799,4742,91,366,False,False,False
VQhIUzPJi8o,18.05.01,Camila Cabello - Never Be The Same,Camila Cabello,10,2017-12-29T17:50:58.000Z,2229440,195151,2595,13538,False,False,False
ZEkImgh--PE,18.18.04,"Halsey - Alone ft. Big Sean, Stefflon Don",HalseyVEVO,10,2018-04-06T13:00:03.000Z,8750901,265647,8220,10452,False,False,False
ys6KVWA4okw,18.04.06,Will It Slip-N-Slide? (EXPERIMENT),Good Mythical Morning,24,2018-05-28T10:00:12.000Z,1813877,48557,2716,6894,False,False,False
JGo_a82jfj8,18.21.05,ADULTS REACT TO EUROVISION SONG CONTEST 2018,FBE,24,2018-05-18T21:00:00.000Z,1551224,42481,3035,14933,False,False,False
jziRzx_rejw,18.22.02,"Meet Nathan Chen, the Figure Skater Who Brought Athleticism to Artistry | NYT - Winter Olympics",The New York Times,25,2018-02-16T01:00:05.000Z,890325,7555,384,694,False,False,False
Y-iFgDK_D5s,18.27.01,The Smallest Bird you have ever seen,A Chick Called Albert,15,2018-01-21T00:10:07.000Z,3953162,140486,2302,14342,False,False,False
wc4v9uT6GWc,17.24.11,Country Music Hall of Famer Mel Tillis has died,USA TODAY,25,2017-11-19T17:22:39.000Z,24462,179,28,151,False,False,False
SMvZa784oow,18.01.05,My Everyday 10 Minute Makeup Tutorial | UPDATED,Laura Lee,26,2018-04-15T21:00:19.000Z,597124,30066,887,2111,False,False,False
9ZrAjnPHzjQ,18.04.02,DIY dot matrix pencil printer,Terrormink,28,2018-01-29T01:18:08.000Z,24658,134,16,70,False,False,False
nd4cLL_MP7M,18.15.05,Mamma Mia! Here We Go Again - Final Trailer,Universal Pictures,24,2018-05-08T12:15:07.000Z,4256549,14114,653,797,False,False,False
mwgUesU1pz4,18.28.03,Under the Silver Lake | Official Trailer HD | A24,A24,1,2018-03-21T12:59:54.000Z,850935,12731,582,1006,False,False,False
OylDdm-6ZH0,18.20.03,I TRIED FOLLOWING A SIMPLY NAILOGICAL MAKEUP TUTORIAL... WOW!,NikkieTutorials,26,2018-03-10T20:00:15.000Z,3143991,198484,4257,10179,False,False,False
eZFvbili87g,17.20.12,The Greatest Showman | Rewrite The Stars ft. Zendaya | 20th Century FOX,20th Century Fox,1,2017-12-14T22:59:49.000Z,224115,8504,49,231,False,False,False
v3UrBcJaczQ,18.08.02,"John Cena vs. Braun Strowman vs. Elias - Winner Enters Elimination Chamber Last: Raw, Feb. 5, 2018",WWE,17,2018-02-06T05:10:43.000Z,2790908,40893,2362,3394,False,False,False
9-2FS7XpTh4,18.26.02,Jimmy Butler sustains apparent non-contact injury | ESPN,ESPN,17,2018-02-24T03:01:18.000Z,96451,348,63,259,False,False,False
-t1q78GYNww,18.23.04,CHEESEBURGER JELLO ASPIC - hamburgers entombed in savory gelatin,emmymadeinjapan,26,2018-04-13T00:00:01.000Z,133022,4995,238,1138,False,False,False
6tAB3YwWkxY,18.07.03,Andy Samberg | Breakfast Club in memoriam tribute | 2018 Film Independent Spirit Awards,Film Independent,1,2018-03-04T20:04:54.000Z,202833,3774,138,160,False,False,False
Hh-YcWJTt7Y,18.05.06,10 Surprising Things That Exist Inside Black Holes,MatthewSantoro,24,2018-05-27T15:23:40.000Z,677463,16940,3119,3530,False,False,False
H7MRHuzCNvM,18.06.03,What it's Like to be a Line Cook at a Top-Rated NYC Restaurant | Bon Appétit,Bon Appétit,24,2018-03-02T17:00:08.000Z,347040,7412,285,798,False,False,False
41PTANtZFW0,18.07.06,Troye Sivan - Bloom,TroyeSivanVEVO,10,2018-06-06T16:00:00.000Z,885830,140990,2664,14693,False,False,False
oRSm7DUvykk,18.06.05,Film Theory: We Found Neverland! (Disney Peter Pan),The Film Theorists,1,2018-05-01T18:06:07.000Z,2559284,83944,2546,10845,False,False,False
kton-qrKNLc,18.05.03,Meghan Trainor - No Excuses,MeghanTrainorVEVO,10,2018-03-01T13:00:05.000Z,5584764,215970,18060,16960,False,False,False
88EB0TEGQDA,18.04.01,Family Feud - Jay Z Ft. Beyonce (Explicit),Beyonce,10,2017-12-29T08:42:07.000Z,1831529,23876,2490,2638,False,False,False
Kemqo35m8gk,18.27.04,I Tried Making Kinetic Sand!,DaveHax,26,2018-04-13T14:09:03.000Z,1393410,12041,1967,1968,False,False,False
Q5KmA3Xbmqo,18.03.06,The Spider and The Butterfly - Animated Short,Dragonfoxgirl,24,2018-05-15T05:06:07.000Z,7073392,329641,5409,44057,False,False,False
I-BGTp-I9aU,18.18.03,Pen Circle Traps Ant (But How?),Reaction Time,24,2018-03-09T21:41:57.000Z,2919117,50785,7506,8906,False,False,False
_7985zBEM3o,18.24.01,Primitive Technology: A-frame hut,Primitive Technology,22,2018-01-19T21:09:10.000Z,4053642,169558,1499,13736,False,False,False
9DjgOFSBJYc,18.23.02,Curling event with vacuum robot and broom - 984342,RM Videos,23,2018-02-14T19:51:16.000Z,176448,1735,197,135,False,False,False
vDyYMcjf500,18.28.05,The History of Fortnite Battle Royale - Did You Know Gaming? Feat. Remix,DidYouKnowGaming?,20,2018-05-24T19:00:24.000Z,257100,6826,1142,1176,False,False,False
Hgc2njyY4Rs,18.05.01,What If 2017 Never Happened?? | CHRIS AND BRITTANY,Chris Reinacher,22,2017-12-27T20:01:59.000Z,73861,4009,411,207,False,False,False
6GT7PrIIS5I,17.24.11,Making loaded dice,Matthias Wandel,26,2017-11-17T12:30:00.000Z,367973,6356,761,527,False,False,False
RjujNLl1jyk,18.30.01,How-To: Make a Deadliest Catch Pineapple Bowl with Trap Kitchen,Munchies,24,2018-01-25T12:00:02.000Z,109832,2760,153,245,False,False,False
QgOXIEhHU1Y,18.02.06,"Diplo, French Montana & Lil Pump ft. Zhavia - Welcome To The Party (Official Video)",Diplo,10,2018-05-21T14:12:22.000Z,18493705,605805,14154,28931,False,False,False
DFZmEaNqdNc,18.01.03,Haul Video #2 | Tacos!,PESfilm,1,2018-02-22T22:34:29.000Z,41375,1764,31,117,False,False,False
m9sR3Z0vVOc,18.29.05,The Smallest House In The World,Daily Dose Of Internet,24,2018-05-27T18:18:44.000Z,1782907,51424,1686,7335,False,False,False
Nr42pNrK5iU,18.01.03,"Sean Evans, Matty Matheson, and Miss Info Judge a Stunt Burger Showdown | The Burger Show",First We Feast,26,2018-02-27T16:00:03.000Z,330477,9661,221,885,False,False,False
tl4I1b6cHKc,18.30.03,SURPRISING MY BIGGEST FANS AT THEIR HOUSE,ElleOfTheMills,24,2018-03-29T20:33:45.000Z,311117,46769,134,2819,False,False,False
1w9tf3vSuVs,17.14.12,"Chit Chat GRWM | Failure, Disappointment & Holidays",Shameless Maya,26,2017-12-13T03:02:20.000Z,24127,3129,17,551,False,False,False
34cHO5_LX9g,18.01.05,SMALLFOOT - Official Trailer 1,Warner Bros. Pictures,24,2018-04-25T00:38:43.000Z,3847697,9799,868,997,False,False,False
kton-qrKNLc,18.04.03,Meghan Trainor - No Excuses,MeghanTrainorVEVO,10,2018-03-01T13:00:05.000Z,4195422,188002,15283,15318,False,False,False
kIHhVkkHV2k,18.24.02,Double Rainbow Unicorn Apple Pie | How To Cook That Ann Reardon,How To Cook That,26,2018-02-23T08:30:11.000Z,113160,4597,144,708,False,False,False
baj6llvgpWA,18.09.02,Justin Timberlake - Man of the Woods (Official Video),justintimberlakeVEVO,10,2018-02-02T05:00:00.000Z,8470806,139599,10709,8771,False,False,False
_EvMYEfF_hQ,17.25.11,Stranger Things Cast Answer the Web's Most Searched Questions | WIRED,WIRED,24,2017-11-21T17:00:22.000Z,11307303,405859,8321,30726,False,False,False
zYX1bgxEAhw,17.25.11,The happiest day of my life,Carla Resendiz,24,2017-11-22T03:30:23.000Z,796106,22438,932,5963,False,False,False
_IoOJu2_FKE,18.05.04,How Ticks Dig In With a Mouth Full of Hooks | Deep Look,Deep Look,28,2018-03-20T12:59:54.000Z,1150554,12460,469,1960,False,False,False
5GHXEGz3PJg,18.15.05,Florence + The Machine - Hunger,FlorenceMachineVEVO,10,2018-05-03T18:35:00.000Z,6144640,136870,2486,5251,False,False,False
vglAsbxMX_Q,17.11.12,ATTEMPTING EVERY 2017 TREND,jennxpenn,24,2017-12-09T19:00:03.000Z,397329,32742,649,1549,False,False,False
EQqIiTk2fy4,18.21.04,Alisha Marie's Birthday Vlog!!,AlishaMarieVlogs,22,2018-04-12T16:52:17.000Z,944427,51523,785,9622,False,False,False
_r9GPgvN8As,17.25.11,SMALLFOOT - Teaser Trailer,Warner Bros. Pictures,24,2017-11-23T00:00:26.000Z,427156,4407,196,519,False,False,False
E_ViwNxUldw,18.27.02,Clear crisps / Glass Potato Chips,My Virgin Kitchen,26,2018-02-21T20:07:18.000Z,566399,9483,947,1129,False,False,False
18QHSoWPygQ,18.20.03,Cardi B: 2018 iHeartRadio Music Awards | Acceptance Speech | TBS,TBS,24,2018-03-12T01:33:22.000Z,987635,23261,2689,4276,False,False,False
qNYhd5QtAlE,18.17.04,Tom Holland Felt Insecure On The Set Of Avengers - The Graham Norton Show,BBC America,24,2018-04-06T21:22:47.000Z,278902,3169,36,90,False,False,False
syAXXLxO8tw,18.02.03,ranking up your friendship,ProZD,1,2018-02-26T19:41:41.000Z,1030322,50602,921,1710,False,False,False
RfFcaV5O7SU,18.13.01,Blockers - Official Trailer (HD),Universal Pictures,24,2018-01-08T16:59:27.000Z,447498,4803,650,446,False,False,False
dQLlS4l1UJk,17.04.12,Galantis & Throttle - Tell Me You Love Me (Official Music Video),Galantis,10,2017-11-28T15:00:58.000Z,338590,16988,247,900,False,False,False
O8pMkVg0O20,18.06.04,UFC 223: Namajunas vs Joanna 2 - Jimmy Smith Preview,UFC - Ultimate Fighting Championship,17,2018-04-02T21:15:03.000Z,134856,2051,56,471,False,False,False
pKkZjjhPCQM,17.06.12,Everything Wrong With Spider-Man: Homecoming,CinemaSins,1,2017-12-05T16:58:28.000Z,1758327,57623,3122,9225,False,False,False
LLiXwMQW_VQ,18.22.03,Is BIGGER BETTER ? - INSANE GIANT LIGHTER Tests,BrainfooTV,24,2018-03-09T16:53:19.000Z,817094,5197,678,590,False,False,False
fKrrlVdFFrw,18.06.01,The Richest Family in the World,Today I Found Out,27,2018-01-02T16:30:01.000Z,156176,7407,162,1064,False,False,False
C6Oo9Hel6MI,18.23.01,How I Make Videos,Anna Akana,23,2018-01-18T17:00:01.000Z,188187,12666,268,759,False,False,False
7_FJUSBFbJM,18.18.04,Game of Zones - Game of Zones - S5:E1: 'A Golden Summer',Bleacher Report,43,2018-04-12T21:00:12.000Z,1155692,29823,434,2081,False,False,False
oLDbO545aKQ,18.05.06,Terrible Magicians | Rudy Mancuso & Juanpa Zurita,Rudy Mancuso,10,2018-05-21T21:00:33.000Z,3585661,191567,4399,10910,False,False,False
oRexsyztGS0,18.24.05,Exciting iPhone 11 Leaks & Round Apple Watch!,EverythingApplePro,24,2018-05-13T18:29:09.000Z,1284650,24260,1590,4037,False,False,False
Wwyxaow1wWg,18.08.01,Inventing The Wheel,J Gasser,24,2017-11-08T22:27:53.000Z,1157,2,1,0,False,False,False
vFK7oWLWapc,17.25.11,Justice League Bad,Jenny Nicholson,1,2017-11-22T03:08:55.000Z,258641,9422,1774,2579,False,False,False
voG07pt-KYI,18.08.06,ZAYN - Entertainer (Official Video),ZaynVEVO,10,2018-05-23T16:00:03.000Z,18740734,612771,15873,37236,False,False,False
eMV_WNJkflM,18.07.03,Roommates Switch Jobs For A Day,BuzzFeedVideo,22,2018-03-05T19:00:45.000Z,338799,7095,295,370,False,False,False
sMLso2du91U,18.25.04,BREAKING: Avicii Dead at 28 | TMZ,TMZ,24,2018-04-20T18:55:28.000Z,2702851,27694,1889,8486,False,False,False
ndb7Ez9m2YM,18.20.04,Lucy Hale Tries 9 Things She's Never Tried Before | Allure,Allure,24,2018-04-10T19:00:35.000Z,477408,12961,118,292,False,False,False
RyquDQ5kWSs,18.27.03,"Judge Faith Jenkins On Syndicated Court TV, Fair Representation For Heinous Crimes  + More",Breakfast Club Power 105.1 FM,24,2018-03-19T12:23:37.000Z,607413,9693,592,5218,False,False,False
VeXoFFxxUyc,18.08.03,Arie Luyendyk & Lauren Burnham the Morning After The Bachelor Finale,LIVEKellyandRyan,24,2018-03-07T15:04:00.000Z,142903,442,147,135,False,False,False
NBSAQenU2Bk,18.21.05,Rooster Teeth Animated Adventures - Millie So Serious,Rooster Teeth,1,2018-05-14T13:00:01.000Z,657458,24151,164,745,False,False,False
T5ITSG6KGlc,18.20.01,No victims as Boeing narrowly avoids plunge into Black Sea,euronews (in English),25,2018-01-14T14:30:14.000Z,1171420,3687,453,1607,False,False,False
25Uouf_9DUk,17.21.12,Controversial incomplete pass by Jesse James Steelers vs Patriots,Sport Hub,22,2017-12-18T00:35:56.000Z,55959,107,60,273,False,False,False
_1mIPOYZzfo,18.22.01,"Diddy Speaks On New Energy, 50 Cent, Mase, 'The Four' + More",Breakfast Club Power 105.1 FM,24,2018-01-18T13:43:23.000Z,1074936,10097,939,5383,False,False,False
6d6SmcYcP_U,17.01.12,Twitter Is FURIOUS VS Fashion Show Aired Model's Runway Fall UNEDITED,Clevver News,24,2017-11-29T23:30:19.000Z,201689,2208,94,376,False,False,False
Fjm81OPZbpU,17.29.11,"Miguel - Come Through and Chill (Audio) ft. J. Cole, Salaam Remi",MiguelVEVO,10,2017-11-27T05:00:00.000Z,383694,20241,167,1349,False,False,False
j6X6PhexHnE,18.01.01,If People Were Honest With Their Parents,Tpindell,23,2017-12-30T03:16:10.000Z,357154,18639,726,1341,False,False,False
szaJ5aW-LUs,17.25.12,Panic! At The Disco - Feels Like Christmas,Panic! At The Disco,10,2017-12-20T16:34:30.000Z,1244968,121754,1074,15778,False,False,False
8h--kFui1JA,18.10.05,Sam Smith - Pray (Official Video) ft. Logic,SamSmithWorldVEVO,10,2018-05-09T17:00:00.000Z,641944,72641,1133,4357,False,False,False
3y75zBl37f8,18.24.03,Adam Rippon Competes in the Olympics of Eating Spicy Wings | Hot Ones,First We Feast,26,2018-03-15T14:58:52.000Z,1096180,33031,5164,5882,False,False,False
GfCqMv--ncA,18.07.01,"Kendrick Lamar, SZA - All The Stars (Audio)",KendrickLamarVEVO,10,2018-01-04T13:00:03.000Z,4005722,172185,2665,10041,False,False,False
08l0K3UyUXE,18.17.03,Rihanna Claps Back at Snapchat for Domestic Violence Ad Featuring Chris Brown,Inside Edition,25,2018-03-15T22:14:12.000Z,211898,1778,196,469,False,False,False
